number,value,datetime_start,datetime_complete,duration,params_augmentation_level,params_batch_size,params_div_factor,params_dropout_rate,params_eta_min,params_factor,params_fc_hidden_size,params_fine_tune_from_layer,params_freeze_backbone,params_gamma,params_lr,params_lr_multiplier_backbone,params_momentum,params_optimizer,params_patience,params_pct_start,params_scheduler,params_step_size,params_warmup_epochs,params_weight_decay,state
0,0.8122772574424744,2026-05-05 11:01:57.558136,2026-05-05 12:45:46.122920,0 days 01:43:48.564784,minimal,64,,0.4879639408647978,,,135,features.5,False,0.5,0.0004059611610484307,0.4115716865497775,,adam,,,step,15.0,,0.00011207606211860574,COMPLETE
1,0.849372923374176,2026-05-05 12:45:46.302213,2026-05-05 15:19:34.646650,0 days 02:33:48.344437,aggressive,64,,0.14881529393791154,,0.1,297,none,False,,0.0010568529720322872,0.0689266113392399,,adamw,2.0,,reduce_on_plateau,,,0.004201672054372531,COMPLETE
2,0.8430362939834595,2026-05-05 15:19:34.852663,2026-05-05 17:31:44.884232,0 days 02:12:10.031569,moderate,128,,0.4947547746402069,,0.1,156,none,False,,0.025924756604751596,0.29917712366085103,0.9385113619277876,sgd,3.0,,reduce_on_plateau,,,0.000348771262454593,COMPLETE
3,0.8262045979499817,2026-05-05 17:31:45.070048,2026-05-05 20:03:34.359195,0 days 02:31:49.289147,randaugment,32,,0.1431565707973218,1.8484491720988594e-06,,137,features.6,False,,0.006533305220227739,0.005905946429591528,,adam,,,warmup_cosine,,5.0,3.151987295193886e-05,COMPLETE
4,0.8477887511253357,2026-05-05 20:03:34.484121,2026-05-05 23:01:44.736687,0 days 02:58:10.252566,randaugment,32,,0.42720590636899725,3.1883397351001856e-07,,292,features.5,False,,0.0001390546848963277,0.47811998212329687,,adamw,,,warmup_cosine,,5.0,0.0017367237151593164,COMPLETE
5,0.5646204352378845,2026-05-05 23:01:44.878749,2026-05-05 23:34:44.434094,0 days 00:32:59.555345,moderate,32,25.0,0.2957811041110252,,,183,features.6,False,,0.00298727419956384,0.926789840692838,0.9383611062362534,sgd,,0.1,one_cycle,,,5.439591236568524e-05,PRUNED
6,0.7159075736999512,2026-05-05 23:34:44.573540,2026-05-05 23:48:23.282384,0 days 00:13:38.708844,randaugment,128,,0.45093574135239245,,,484,features.6,False,0.1,0.0005731537801106999,0.019611076185240744,,adamw,,,step,15.0,,0.0030458224385894067,PRUNED
7,0.8492408990859985,2026-05-05 23:48:23.411620,2026-05-06 01:20:47.605460,0 days 01:32:24.193840,randaugment,128,,0.3607845038010402,3.3916008494386095e-07,,394,none,False,,0.0031115931750282638,0.016406668852656958,,adam,,,cosine,,,0.00019918920492197507,COMPLETE
8,0.6801320314407349,2026-05-06 01:20:47.749495,2026-05-06 01:43:08.923810,0 days 00:22:21.174315,minimal,64,,0.21230894497634234,,0.1,406,features.5,False,,0.08088298191148205,0.005687504751255328,0.9738242341418852,sgd,2.0,,reduce_on_plateau,,,5.4994264803456034e-05,PRUNED
9,0.7029703259468079,2026-05-06 01:43:09.049036,2026-05-06 02:10:09.370846,0 days 00:27:00.321810,randaugment,64,,0.37880629639810726,,,413,none,False,0.5,0.04170871302599373,0.20673164150667198,0.9647437405302197,sgd,,,step,10.0,,0.0006706271090367463,PRUNED
10,0.8343234062194824,2026-05-06 02:10:09.511724,2026-05-06 04:14:28.362695,0 days 02:04:18.850971,aggressive,64,,0.10594871528771761,,0.5,261,none,False,,0.0005620000511958316,0.07259148983360236,,adamw,2.0,,reduce_on_plateau,,,0.03691979171780843,PRUNED
11,0.8452805280685425,2026-05-06 04:14:31.037652,2026-05-06 06:31:55.556323,0 days 02:17:24.518671,aggressive,128,,0.32931639106049165,1.2504855205321396e-07,,366,none,False,,0.0019575500799074554,0.02878873519377647,,adam,,,cosine,,,1.5657424020089615e-05,PRUNED
12,0.8134653568267822,2026-05-06 06:31:58.260936,2026-05-06 07:29:46.015727,0 days 00:57:47.754791,aggressive,128,,0.23711971530652654,8.398022040845235e-06,,238,none,False,,0.0015754162909931394,0.0674723286320151,,adam,,,cosine,,,0.0001871755470679819,PRUNED
13,0.7681187987327576,2026-05-06 07:29:46.167825,2026-05-06 07:59:38.006938,0 days 00:29:51.839113,aggressive,128,,0.232217722624184,8.028836717487805e-07,,334,none,False,,0.001004751162821496,0.017301747322810295,,adamw,,,cosine,,,0.013109833200274265,PRUNED
14,0.8580858111381531,2026-05-06 07:59:38.167837,2026-05-06 10:12:30.626061,0 days 02:12:52.458224,randaugment,64,10.0,0.3160037898064164,,,488,none,False,,5.370203809578864e-05,0.07969781863783433,,adamw,,0.2,one_cycle,,,0.0900602049993969,COMPLETE
15,0.7819802165031433,2026-05-06 10:12:30.753461,2026-05-06 10:44:43.970336,0 days 00:32:13.216875,aggressive,64,10.0,0.28480748811198797,,,509,none,False,,5.1157558643466635e-05,0.10216553353680852,,adamw,,0.2,one_cycle,,,0.08184593994836266,PRUNED
16,0.8064026236534119,2026-05-06 10:44:44.134874,2026-05-06 11:21:46.113528,0 days 00:37:01.978654,minimal,64,10.0,0.17157730314733532,,,464,none,False,,0.00015433736178353414,0.1324264843841343,,adamw,,0.2,one_cycle,,,0.008795188471333254,PRUNED
17,0.7577557563781738,2026-05-06 11:21:46.269330,2026-05-06 11:53:18.739013,0 days 00:31:32.469683,moderate,64,50.0,0.26691672988169635,,,212,none,False,,5.920680639435346e-05,0.043508896676895475,,adamw,,0.3,one_cycle,,,0.01017868773818447,PRUNED
18,0.7699009776115417,2026-05-06 11:53:18.873281,2026-05-06 12:23:28.840955,0 days 00:30:09.967674,aggressive,64,,0.18749703687348243,,0.2,339,features.6,False,,0.00025973238998515906,0.16188704682406277,,adamw,5.0,,reduce_on_plateau,,,0.004106486758182398,PRUNED
19,0.6876567602157593,2026-05-06 12:23:31.609102,2026-05-06 12:46:15.283664,0 days 00:22:43.674562,randaugment,64,,0.35582343732454313,,0.1,294,features.5,False,,9.853359539290798e-05,0.04020899006847235,,adamw,2.0,,reduce_on_plateau,,,0.027030025897176683,PRUNED
20,0.763300359249115,2026-05-06 12:46:15.422972,2026-05-06 13:17:59.191007,0 days 00:31:43.768035,aggressive,64,10.0,0.4097964473511103,,,459,none,False,,0.0002799082684189076,0.07498386798293148,,adamw,,0.2,one_cycle,,,0.0706381634889459,PRUNED
21,0.7955775856971741,2026-05-06 13:18:01.973188,2026-05-06 13:41:01.825630,0 days 00:22:59.852442,randaugment,128,,0.33490776724156485,1.4459535982129771e-07,,414,none,False,,0.003146063728436383,0.01093019931365179,,adam,,,cosine,,,0.0003047982743515373,PRUNED
22,0.7361716032028198,2026-05-06 13:41:01.998403,2026-05-06 14:00:32.671567,0 days 00:19:30.673164,randaugment,128,,0.3782947246006406,8.484628141166179e-07,,374,none,False,,0.0009324762975728527,0.011195139398216746,,adam,,,cosine,,,0.00035307737438277395,PRUNED
23,0.7796699404716492,2026-05-06 14:00:32.841279,2026-05-06 14:44:49.752699,0 days 00:44:16.911420,randaugment,32,,0.333590882063526,2.652187717966283e-06,,381,none,False,,0.004025972777804797,0.044319212737245844,,adam,,,cosine,,,1.2785940667144152e-05,PRUNED
24,0.754323422908783,2026-05-06 14:44:52.375609,2026-05-06 15:12:34.967162,0 days 00:27:42.591553,randaugment,64,,0.26764229802478434,4.4577653385162575e-07,,456,none,False,,0.0010432979992076542,0.02653762095516543,,adamw,,,warmup_cosine,,10.0,0.02993676606147473,PRUNED
