number,value,datetime_start,datetime_complete,duration,params_augmentation_level,params_batch_size,params_div_factor,params_dropout_rate,params_eta_min,params_factor,params_fc_hidden_size,params_fine_tune_from_layer,params_freeze_backbone,params_gamma,params_lr,params_lr_multiplier_backbone,params_momentum,params_optimizer,params_patience,params_pct_start,params_scheduler,params_step_size,params_warmup_epochs,params_weight_decay,state
0,0.7701650261878967,2026-05-07 15:56:23.898853,2026-05-07 16:34:54.090202,0 days 00:38:30.191349,minimal,64,,0.29097295564859826,,,135,features.5,False,0.5,0.0004059611610484307,0.4115716865497775,,adam,,,step,15.0,,0.00011207606211860574,COMPLETE
1,0.8609240651130676,2026-05-07 16:34:54.231965,2026-05-07 18:57:27.720563,0 days 02:22:33.488598,aggressive,64,,0.036611470453433645,,0.1,297,none,False,,0.0010568529720322872,0.0689266113392399,,adamw,2.0,,reduce_on_plateau,,,0.004201672054372531,COMPLETE
2,0.8177557587623596,2026-05-07 18:57:27.870884,2026-05-07 21:06:02.835933,0 days 02:08:34.965049,moderate,128,,0.2960660809801552,,0.1,156,none,False,,0.025924756604751596,0.29917712366085103,0.9385113619277876,sgd,3.0,,reduce_on_plateau,,,0.000348771262454593,COMPLETE
3,0.824554443359375,2026-05-07 21:06:03.391700,2026-05-07 22:17:13.994305,0 days 01:11:10.602605,randaugment,32,,0.032367428097991334,1.8484491720988594e-06,,137,features.6,False,,0.006533305220227739,0.005905946429591528,,adam,,,warmup_cosine,,5.0,3.151987295193886e-05,COMPLETE
4,,2026-05-07 22:17:14.119655,2026-05-07 23:02:41.847162,0 days 00:45:27.727507,randaugment,32,,0.24540442977674792,3.1883397351001856e-07,,292,features.5,False,,0.0001390546848963277,0.47811998212329687,,adamw,,,warmup_cosine,,5.0,0.0017367237151593164,FAIL
5,0.7710891366004944,2026-05-07 23:03:17.005751,2026-05-07 23:35:03.832997,0 days 00:31:46.827246,minimal,64,,0.29097295564859826,,,135,features.5,False,0.5,0.0004059611610484307,0.4115716865497775,,adam,,,step,15.0,,0.00011207606211860574,COMPLETE
6,0.8478547930717468,2026-05-07 23:35:03.992475,2026-05-08 01:59:13.478820,0 days 02:24:09.486345,aggressive,64,,0.036611470453433645,,0.1,297,none,False,,0.0010568529720322872,0.0689266113392399,,adamw,2.0,,reduce_on_plateau,,,0.004201672054372531,COMPLETE
7,0.7608580589294434,2026-05-08 01:59:13.606263,2026-05-08 02:25:41.729307,0 days 00:26:28.123044,moderate,128,,0.2960660809801552,,0.1,156,none,False,,0.025924756604751596,0.29917712366085103,0.9385113619277876,sgd,3.0,,reduce_on_plateau,,,0.000348771262454593,PRUNED
8,0.7195379734039307,2026-05-08 02:25:41.856048,2026-05-08 02:40:49.447886,0 days 00:15:07.591838,randaugment,32,,0.032367428097991334,1.8484491720988594e-06,,137,features.6,False,,0.006533305220227739,0.005905946429591528,,adam,,,warmup_cosine,,5.0,3.151987295193886e-05,PRUNED
9,0.8675907850265503,2026-05-08 02:40:49.588553,2026-05-08 04:10:58.033231,0 days 01:30:08.444678,randaugment,32,,0.24540442977674792,3.1883397351001856e-07,,292,features.5,False,,0.0001390546848963277,0.47811998212329687,,adamw,,,warmup_cosine,,5.0,0.0017367237151593164,COMPLETE
10,0.665478527545929,2026-05-08 04:10:58.169239,2026-05-08 04:38:50.323281,0 days 00:27:52.154042,moderate,32,25.0,0.1468358280832689,,,183,features.6,False,,0.00298727419956384,0.926789840692838,0.9383611062362534,sgd,,0.1,one_cycle,,,5.439591236568524e-05,PRUNED
11,0.7291089296340942,2026-05-08 04:38:50.446502,2026-05-08 04:57:45.199234,0 days 00:18:54.752732,randaugment,32,,0.20741632790413553,1.1401357990728682e-07,,486,features.5,False,,5.4221871396973596e-05,0.024579818846854087,,adamw,,,cosine,,,0.07832921114568382,PRUNED
12,0.713399350643158,2026-05-08 04:57:45.324018,2026-05-08 05:27:07.579404,0 days 00:29:22.255386,aggressive,64,,0.11683795120128827,1.8939596809590337e-07,,309,features.5,False,,0.00011548292569797719,0.05916752571878046,,adamw,,,warmup_cosine,,3.0,0.005959206131645764,PRUNED
13,0.7501650452613831,2026-05-08 05:27:07.702556,2026-05-08 05:58:41.140833,0 days 00:31:33.438277,aggressive,32,10.0,0.21359334066402358,,,238,none,False,,0.00015509498193285592,0.13939247818091421,,adamw,,0.2,one_cycle,,,0.003019978043692996,PRUNED
14,0.8555115461349487,2026-05-08 05:58:41.264032,2026-05-08 07:19:33.560073,0 days 01:20:52.296041,randaugment,64,,0.08029224317626871,4.280411643333819e-07,,393,none,False,,0.0008395434836173338,0.026619817550438834,,adamw,,,cosine,,,0.013113848502320584,COMPLETE
15,0.7754455208778381,2026-05-08 07:19:33.702270,2026-05-08 07:48:09.546006,0 days 00:28:35.843736,aggressive,128,,0.21880458059920274,,0.2,377,features.5,False,,0.0001918511207539673,0.13701004515145632,,adamw,2.0,,reduce_on_plateau,,,0.011496806680226864,PRUNED
16,0.5747194886207581,2026-05-08 07:48:09.925790,2026-05-08 08:14:34.035674,0 days 00:26:24.109884,randaugment,32,,0.17380213588725785,6.380949865049272e-06,,259,none,False,,5.576488710905934e-05,0.021576366575301834,,adamw,,,warmup_cosine,,10.0,0.002440674145346877,PRUNED
17,0.7167657017707825,2026-05-08 08:14:34.194802,2026-05-08 08:47:10.728456,0 days 00:32:36.533654,aggressive,64,,0.08130921490966073,5.56727201491366e-07,,372,features.5,False,,0.0008118311804092797,0.7736914528622367,,adamw,,,warmup_cosine,,5.0,0.028254389819034765,PRUNED
18,0.8525412678718567,2026-05-08 08:47:10.889917,2026-05-08 10:51:33.268968,0 days 02:04:22.379051,minimal,32,,0.002373068503723569,,0.5,244,none,False,,0.0002529109400151379,0.14278135997719335,,adamw,5.0,,reduce_on_plateau,,,0.00208138936962105,COMPLETE
19,0.7559075951576233,2026-05-08 10:51:33.426880,2026-05-08 11:20:48.121861,0 days 00:29:14.694981,aggressive,64,50.0,0.24931041852757171,,,441,features.5,False,,0.000115028792041609,0.03774778148746718,,adamw,,0.3,one_cycle,,,0.006317641912492184,PRUNED
20,0.7439603805541992,2026-05-08 11:20:48.414726,2026-05-08 11:32:32.130139,0 days 00:11:43.715413,randaugment,128,,0.1663069853765111,3.08729477416819e-07,,209,features.6,False,,0.07989932613446935,0.09886496143198983,0.8104343348906051,sgd,,,cosine,,,0.000475613088145057,PRUNED
21,0.8237623572349548,2026-05-08 11:32:32.287575,2026-05-08 12:17:12.791892,0 days 00:44:40.504317,randaugment,32,,0.11663430099210206,,,331,none,False,0.1,0.001294351101505086,0.012131553066415704,,adamw,,,step,5.0,,0.0018713185255353332,PRUNED
22,0.8552474975585938,2026-05-08 12:17:12.941082,2026-05-08 13:36:09.134941,0 days 01:18:56.193859,randaugment,64,,0.07576722444340392,5.988359749990569e-07,,375,none,False,,0.0006915740887273893,0.029954835325979853,,adamw,,,cosine,,,0.013768125630464569,COMPLETE
23,0.801716148853302,2026-05-08 13:36:09.290758,2026-05-08 13:52:57.044717,0 days 00:16:47.753959,randaugment,64,,0.07227407255866615,4.0369238212640966e-07,,422,none,False,,0.0015832047484894902,0.01305378589273199,,adamw,,,cosine,,,0.024858052787627267,PRUNED
24,0.8588778972625732,2026-05-08 13:52:57.201211,2026-05-08 15:12:02.698611,0 days 01:19:05.497400,randaugment,64,,0.11383173144491862,1.2069557084321893e-06,,276,none,False,,0.0005656170996240247,0.049031456248910636,,adamw,,,cosine,,,0.007204715634751562,COMPLETE
25,0.8048844933509827,2026-05-08 15:12:02.869141,2026-05-08 15:29:22.241459,0 days 00:17:19.372318,randaugment,64,,0.12511596298548788,1.2724787405181648e-06,,284,none,False,,0.0002909617568635495,0.052307398488125836,,adamw,,,cosine,,,0.007109441685832622,PRUNED
26,0.7819802165031433,2026-05-08 15:29:22.414767,2026-05-08 15:58:41.493392,0 days 00:29:19.078625,aggressive,64,,0.25195153685448396,4.370471489831399e-06,,334,features.5,False,,0.0005528717097495807,0.09190154645278305,,adamw,,,warmup_cosine,,3.0,0.0037107314374556755,PRUNED
27,0.7538613677024841,2026-05-08 15:58:41.633617,2026-05-08 16:15:47.741484,0 days 00:17:06.107867,minimal,64,,0.05651213600883979,,0.2,271,none,False,,0.0017904330917397537,0.20080766981978726,,adamw,2.0,,reduce_on_plateau,,,0.004694911396530721,PRUNED
28,0.737227737903595,2026-05-08 16:15:47.887000,2026-05-08 16:42:50.523743,0 days 00:27:02.636743,moderate,64,,0.0013745591908471688,,0.5,224,none,False,,8.468452448099091e-05,0.04095124141236962,,adamw,5.0,,reduce_on_plateau,,,0.020342584574131926,PRUNED
29,0.7459405660629272,2026-05-08 16:42:50.677813,2026-05-08 16:54:38.599571,0 days 00:11:47.921758,randaugment,128,,0.15483330191112793,8.468228623096451e-07,,349,features.6,False,,0.002367569333038902,0.018340726595694596,,adam,,,warmup_cosine,,10.0,1.1308411801016205e-05,PRUNED
30,0.7061386108398438,2026-05-08 16:54:38.786477,2026-05-08 17:13:23.438589,0 days 00:18:44.652112,minimal,32,,0.19044642680479085,,,207,features.5,False,0.2,0.00423834297313077,0.6466302322747435,0.826295492395921,sgd,,,step,10.0,,0.0006549980954066145,PRUNED
