number,value,datetime_start,datetime_complete,duration,params_augmentation_level,params_batch_size,params_div_factor,params_dropout_rate,params_eta_min,params_factor,params_fc_hidden_size,params_fine_tune_from_layer,params_freeze_backbone,params_gamma,params_lr,params_lr_multiplier_backbone,params_momentum,params_optimizer,params_patience,params_pct_start,params_scheduler,params_step_size,params_warmup_epochs,params_weight_decay,state
0,,2026-04-27 12:43:44.890713,2026-04-27 12:52:58.797499,0 days 00:09:13.906786,minimal,64,,0.389468448256698,,,135,features.5,False,0.5,0.0004059611610484307,0.4115716865497775,,adam,,,step,15.0,,0.00011207606211860574,FAIL
1,0.7528052926063538,2026-05-06 15:12:39.149448,2026-05-06 15:57:30.933885,0 days 00:44:51.784437,minimal,64,,0.389468448256698,,,135,features.5,False,0.5,0.0004059611610484307,0.4115716865497775,,adam,,,step,15.0,,0.00011207606211860574,COMPLETE
2,0.867722749710083,2026-05-06 15:57:31.084333,2026-05-06 18:30:51.464899,0 days 02:33:20.380566,aggressive,64,,0.0927133821956726,,0.1,297,none,False,,0.0010568529720322872,0.0689266113392399,,adamw,2.0,,reduce_on_plateau,,,0.004201672054372531,COMPLETE
3,0.7786138653755188,2026-05-06 18:30:51.608365,2026-05-06 20:50:11.259731,0 days 02:19:19.651366,moderate,128,,0.3954104278101811,,0.1,156,none,False,,0.025924756604751596,0.29917712366085103,0.9385113619277876,sgd,3.0,,reduce_on_plateau,,,0.000348771262454593,COMPLETE
4,0.8058086037635803,2026-05-06 20:50:11.412030,2026-05-06 22:16:33.010335,0 days 01:26:21.598305,randaugment,32,,0.08776199944765656,1.8484491720988594e-06,,137,features.6,False,,0.006533305220227739,0.005905946429591528,,adam,,,warmup_cosine,,5.0,3.151987295193886e-05,COMPLETE
5,,2026-05-06 22:16:33.152324,2026-05-06 22:23:35.143715,0 days 00:07:01.991391,randaugment,32,,0.3363051680728726,3.1883397351001856e-07,,292,features.5,False,,0.0001390546848963277,0.47811998212329687,,adamw,,,warmup_cosine,,5.0,0.0017367237151593164,FAIL
6,0.7529373168945312,2026-05-06 22:24:17.561614,2026-05-06 23:05:16.895993,0 days 00:40:59.334379,minimal,64,,0.389468448256698,,,135,features.5,False,0.5,0.0004059611610484307,0.4115716865497775,,adam,,,step,15.0,,0.00011207606211860574,COMPLETE
7,0.8659405708312988,2026-05-06 23:05:17.063828,2026-05-07 01:38:56.517479,0 days 02:33:39.453651,aggressive,64,,0.0927133821956726,,0.1,297,none,False,,0.0010568529720322872,0.0689266113392399,,adamw,2.0,,reduce_on_plateau,,,0.004201672054372531,COMPLETE
8,0.7383498549461365,2026-05-07 01:38:56.644477,2026-05-07 02:08:56.877658,0 days 00:30:00.233181,moderate,128,,0.3954104278101811,,0.1,156,none,False,,0.025924756604751596,0.29917712366085103,0.9385113619277876,sgd,3.0,,reduce_on_plateau,,,0.000348771262454593,PRUNED
9,0.6667986512184143,2026-05-07 02:08:59.830323,2026-05-07 02:28:05.505396,0 days 00:19:05.675073,randaugment,32,,0.08776199944765656,1.8484491720988594e-06,,137,features.6,False,,0.006533305220227739,0.005905946429591528,,adam,,,warmup_cosine,,5.0,3.151987295193886e-05,PRUNED
10,0.868976891040802,2026-05-07 02:28:05.621164,2026-05-07 04:41:23.951261,0 days 02:13:18.330097,randaugment,32,,0.3363051680728726,3.1883397351001856e-07,,292,features.5,False,,0.0001390546848963277,0.47811998212329687,,adamw,,,warmup_cosine,,5.0,0.0017367237151593164,COMPLETE
11,0.534455418586731,2026-05-07 04:41:24.105088,2026-05-07 05:10:52.852806,0 days 00:29:28.747718,moderate,32,25.0,0.22130846609714705,,,183,features.6,False,,0.00298727419956384,0.926789840692838,0.9383611062362534,sgd,,0.1,one_cycle,,,5.439591236568524e-05,PRUNED
12,0.7215181589126587,2026-05-07 05:10:52.968549,2026-05-07 05:37:19.880044,0 days 00:26:26.911495,randaugment,32,,0.29198571588815814,1.1401357990728682e-07,,486,features.5,False,,5.4221871396973596e-05,0.024579818846854087,,adamw,,,cosine,,,0.07832921114568382,PRUNED
13,0.7164356708526611,2026-05-07 05:37:20.017949,2026-05-07 06:09:04.101671,0 days 00:31:44.083722,aggressive,64,,0.18631094306816964,1.8939596809590337e-07,,309,features.5,False,,0.00011548292569797719,0.05916752571878046,,adamw,,,warmup_cosine,,3.0,0.005959206131645764,PRUNED
14,,2026-05-07 06:09:04.253601,2026-05-07 07:13:46.565158,0 days 01:04:42.311557,aggressive,32,10.0,0.29919223077469415,,,238,none,False,,0.00015509498193285592,0.13939247818091421,,adamw,,0.2,one_cycle,,,0.003019978043692996,FAIL
15,0.8230363130569458,2026-05-07 07:14:12.333069,2026-05-07 08:43:58.120966,0 days 01:29:45.787897,aggressive,32,,0.3003093642688783,8.61138227435634e-06,,379,none,False,,0.00017538688955118773,0.024579818846854087,,adamw,,,cosine,,,0.0030524386888490193,PRUNED
16,0.8011881113052368,2026-05-07 08:44:00.911355,2026-05-07 09:55:00.754200,0 days 01:10:59.842845,aggressive,64,50.0,0.16140018754368285,,,250,features.5,False,,0.0008119148209495673,0.13744823479749593,,adamw,,0.3,one_cycle,,,0.013546570882150416,PRUNED
17,0.6985478401184082,2026-05-07 09:55:00.878580,2026-05-07 10:18:28.905750,0 days 00:23:28.027170,randaugment,128,,0.29919223077469415,4.2118206722764704e-07,,425,none,False,,0.00015509498193285592,0.13939247818091421,,adamw,,,warmup_cosine,,10.0,0.012221220737054192,PRUNED
18,0.8479207754135132,2026-05-07 10:18:31.666900,2026-05-07 11:43:11.930329,0 days 01:24:40.263429,aggressive,32,,0.14367428370564683,,0.2,237,none,False,,0.0008395434836173338,0.029395941171574413,,adamw,5.0,,reduce_on_plateau,,,0.002205121858762209,PRUNED
19,0.8572277426719666,2026-05-07 11:43:14.628496,2026-05-07 12:46:45.614540,0 days 01:03:30.986044,randaugment,64,,0.24590785848709418,5.30483562608023e-07,,365,features.5,False,,5.1103452735303154e-05,0.9502587594253354,,adamw,,,warmup_cosine,,5.0,0.006823849970527324,PRUNED
20,0.8596699833869934,2026-05-07 12:46:48.334483,2026-05-07 14:24:46.842322,0 days 01:37:58.507839,minimal,64,,0.05324188279923194,,0.5,249,none,False,,0.00026378784343809056,0.145881631489184,,adamw,2.0,,reduce_on_plateau,,,0.023952389782365274,PRUNED
21,0.8399339914321899,2026-05-07 14:24:49.975729,2026-05-07 15:42:40.169236,0 days 01:17:50.193507,aggressive,32,,0.2474660549551883,3.52211864080435e-07,,349,features.5,False,,0.0014158260170087458,0.013065482760075266,,adamw,,,cosine,,,0.0020754539182299275,PRUNED
22,0.6512210965156555,2026-05-07 15:42:40.295061,2026-05-07 15:56:19.664287,0 days 00:13:39.369226,randaugment,128,,0.3186407659886432,,,417,features.6,False,0.2,0.05450721698389953,0.036763725994044996,0.8121267714174605,sgd,,,step,10.0,,0.0004495850801549467,PRUNED
